text,angry
i didn t leave feeling sarcastic and annoyed at having to treat someone as though they re better than me,1
i feel like there s a reason to buy another tom petty record,1
i was still feeling bitchy not sad,1
i feel a petty sting of worry that i wont have tv reception for the breeders cup,1
i have a feeling the googler in this case was again dissatisfied with his search results,1
i prevent them from inevitably feeling insulted when i tell them that life here just isn t enough for me anymore,1
i feel appalled at my sadness and hurt,1
i feel a bit bitchy today lt take a look its free and it doesnt concern you so i was reading the critics for mamma mia,1
i spent most of the first day feeling pissed off thanks to the tourism and hospitality workers who trump thailands comparatively feeble efforts to fleece gullible white people,1
i was feeling very spiteful and was only encouraged by this bit of information,1
i think youre being a dick bitch id just walk away instead of laying out everything i feel when im pissed i shut down and look out the window in steely silence,1
i feel like im heartless cuz a week after my boyfirend of months broke up with me i was thinking about another guy,1
i feel when i mad at you,1
ill admit there is definitely some sort of testosterone laden feeling of accomplishment in being a fucking savage helping women who cannot control a way unruly crowd,1
i suggest you do though it might be hard cause it is a bit slow at times if you don t feel a bit of a tug at your heart or perhaps feel a tear forming in your tear ducts i will declare that you are heartless and thus should be banished from the rest of the world,1
i know exactly how she feels because i hated it so badly i got so depressed i was cutting myself when i got so low i started thinking about suicide i did run away to nyc the farthest place from them where they wouldnt be able to find me,1
ill find you everyday if you feel not annoyed,1
im no longer feeling bitchy,1
im just feeling grumpy and impatient and im ready to get things moving,1
i didnt want to shoot him sorry to be a party pooper because i have been a lecture basher before and i know how it feels when people are hostile to you,1
i feel him i touch him with my hands i form him without wanting to i give him to myself i take him away from myself how impatient i am to see him,1
i almost always feel the inside of my tire but in my rushed state i failed to do this important step,1
i feel grouchy tonight,1
i love if i feel a cold coming on,1
i feel like the world is just being bitter and cold but its degrees out sunny and bold something went a rye before early tea time and i cant figure it out yet,1
i see people who have accomplished so much more than me and i feel envious and incompetent,1
i started to see a concerning pattern i d rush home at the end of the evening s activities to write out a post sometimes i d be feeling frustrated and flustered while sometimes i was eager and inspired,1
i feel so tortured by it,1
i feel a bit rude leaving you hanging there from my last post with an almost done room and then radio silence,1
