text,angry
diagnosis that i have a stomache ulcer,0
ive been having more frequent hot flashes throughout the day sometimes and im starting to feel just a tender touch of achy pain in one spot in my back which i hope isnt another new bone tumor metastasis,0
i was laughing at my husband because he was still feeling skeptical with me cooking nice gozelemes,0
i walk into a restaurant well any public place i feel like all eyes are on me and i feel really paranoid,0
ive just been feeling extremely outcasted and insecure,0
i just really was feeling appreciative of and connected to nature,0
i feel as though i am boring or a bit dull because it is hard to keep up with her energy and i do not want her to get the wrong impression,0
i am so thankful for my dream i started drawing again made me feel talented and framed my dream i can go after whatever i want,0
i feel it is a vital sentiment that should be cherished and further nourished for every seconds of my life,0
i haven t ran in a long time since my half marathon so my legs are feeling a bit shaky now,0
i feel incredibly lucky just to be able to talk to her,0
i can only feel rejected and tossed aside and hurt for so long before i get enough guts to just pick up and move on,0
i do see some of the value and ideas in functional programming style but somehow i feel really really hesitant to switch my java and python programming environments with tested and proven libraries to emerging ones in haskell domain,0
ive spent a good chunk of the day feeling quite agitated in a taut way as though it wouldnt take much for me to really snap and chew someones head off,0
i feel not just attracted to but completely enthralled and captivated by him like hes some kind of other worldly creature with nothing inside him but a really bright light,0
i do what i do because it feels lame to go along with the customary flow,0
im feeling truly adventurous ill go for a faux hawk of some sort,0
i would lie in bed and feel it somehow sparkle and i knew that even if most meningiomas are benign mine was growing and needed to come out sooner rather than later,0
i have had several new members tell me how comfortable they feel with how accepted they are by the existing members and that is great to hear,0
i feel like i come from a pretty innocent happy go lucky idealistic mindset that i feel like make me not such an ideal candidate to help those in the church fully understand who they are in christ and how they can live for him,0
i wish there was something i could do sitting here in the midwest i feel so helpless,0
i feel so alone in the world with nobody to talk to to share my feelings with,0
i how he is feeling about the fight i m disappointed and kind of disgusted with myself,0
i don t feel all that romantic,0
i feel he is an terrific really worth bet,0
i was just telling you how i feel about you and all you reply back was just since when you started caring for me so much,0
i have just been feeling so thankful humbled and blessed for my family and where we are in our life,0
i feel its hardly a loss since the food at kao chi is not only delicious but also more budget friendly,0
i love those kiddos and yet am left feeling so helpless,0
i wasn t feeling especially sympathetic,0
i feel that pain now and am fearful that i will have to endure that for many years to come,0
i always feel fearless january st,0
im feeling so lethargic and these shows are keeping me amused,0
i hate hate hate watching people work and me sitting and most of all i hate people having to take care of me so i thought i was healing at a fine rate i was feeling fairly strong and energetic just seemed to get tired quickly and i could manage the surgery healing pain,0
i sincerely feel will benefit any relationship whether it is romantic family work or socially oriented,0
i then felt a feeling of awkwardness and discontent cuz he said yeah me too and not im sorry,0
i feel so terrified to tell her,0
i have would be that common ground but i always feel like i m a casual observer rather than an enthusiast,0
ive been consumed by guilt and other feelings of discontent,0
i have gained some weight i feel very insecure in my self image,0
i still feel shaky but it is gradually getting better i have no idea what is going on,0
i just want to stop feeling this terrified of the unknown,0
i wrote this article because if the extroverts can become more educated about introverts introverts will be able to feel free to stay true to who they are and that s a good thing from society s point of view,0
i was feeling at the time i wrote this say something like oh dont worry leanne youll find your prince charming someday,0
im not sure how much each diploma will cost or if its even recognized in this country but its something to make me feel productive and add to my resume when the babys old enough to allow me to go back to work,0
im not going to lie it feels really weird to be writing this right now,0
i do what i can to still feel like a valuable member,0
i feel as though that talking for a month is acceptable but please pretty please get together after that,0
i find that despite the fact that i feel like i really liked this book i certainly read through the entire thing like i had a physical need to find out what happens next i cant think of anything to say about it,0
i don t like orange but today i m feeling strangely sympathetic towards it,0
i just don t understand the betrayal the lying the hiding and the making me feel like crap with comments of you re paranoid,0
i feel like our society has programmed little girls to begin dreaming of having a prince charming a big wedding and a happy family at a very young age,0
i everyone this will be a bit of a brief post as ive got a stinking cold at the moment and am feeling very very crappy but i have another page done on,0
i feel most vulnerable exhausted and plum used up i look up to the heavens and catch myself muttering pleading god be enough,0
i have also been getting back into my gym routine so im feeling positive about this now,0
im feeling really horny with all this new power,0
i must admit by the time i got back dripping i was feeling like id been beaten it was very much a run of three thirds,0
i miss our talks our cuddling our kissing and the feelings that you can only share with your beloved,0
i feel personally hated when i read their poems,0
i was feeling fine,0
i dont know if it was because i almost got a feeling that he actually might like me or if it was because i got the feeling that he liked olivia,0
i normally would want to eat this when i feel the world is dull,0
i said before i feel like a hypocrite advocating for diabetes support and awareness without supporting my own situation,0
i just want someone who ll make feel that i m terrified the one who ll make me crazily say i m in love i m terrified for the first time,0
i love feeling carefree and without all these nervous feelings shooting through my body like i just saw myself on americas most wanted,0
i am sure she makes all waiting couples feel this way but we left feeling like she is pulling for us and she will be so thrilled when it all works out,0
i feel this game is so precious to everyone not only to the players,0
i knew there were a lot of hormonal things going on in my body too but the uncontrollable crying was still from feeling so uncertain about everything,0
i think i spent too much of my young life feeling romantic to have much saved up for adult me,0
i start feeling dumb,0
i feel more well rested though my sinuses still hurt and my voice isn t quite back to normal,0
i do feel pressured to do this though,0
i would end up feeling rejected and feeling like they just played a cruel joke on me by getting my hopes up just to purposely crush them,0
i feel pretty oh so pretty i feel pretty and,0
im in college and feeling really lonely,0
im feeling fabulous today because i love my job,0
im feeling happy sad or angry,0
i want nothing more than to continue this journey empowering women who because of their illness feel helpless and isolated,0
i feel strongly that by supporting because i am a girl we can have a positive impact on girls both on and off the soccer field said christine sinclair captain canadian women s national team,0
i didn t feel abused and quite honestly it made my day a little better,0
i was feeling much more agitated than usual had difficulties sleeping and constantly required my parents presence,0
i also feel ashamed at the hurt caused and ashamed at the things ive done that were not in my character and were down to being manic or whatever you want to call it,0
i sat in the car and read my book which suited me just fine i also wasnt feeling very sociable that morning due to a rather bad nightmare the night before so reading my book was the best thing to do,0
i do remember my left quad starting to feel strange not hurting yet an aggravating feeling about a week or two before the marathon,0
i feel amused and free,0
i had feeling that if i didn t help that this can turn into a bad scene,0
i feel funny inside is that a reference to the circus going on in his underpants,0
i wont lie either i was feeling pretty superior as i was out there running knowing that very few people make a christmas day workout a priority,0
i feel try to tell me im ungrateful tell me im basically the worst daughter sister in the world,0
im feeling so melancholy all day i know this is because ive been reading the perks of again,0
i woke up feeling groggy and in so much pain,0
ive been feeling really gloomy about some situations in my life and im stuffing my emotions with good,0
i can have such a faith because i believe that there are people who have left feeling dismayed and disappointed in a god who did no miracles in their lives,0
i feel like ive hit a sweet spot in life,0
i say this mostly because i wasnt feeling so well later that evening,0
i like the feel of the game but im not very fond of the color scheme,0
i feel frightened to see a million youngsters aspi,0
i experienced a v drink today which is supposed to give you boundless energy for a while though full of the cold as i am i didnt feel bouncy though h noticed my speech quicken after minutes or so,0
i feel so useless as i am bent on p here on the floor,0
im feeling a little better and with more christmas spirit i thought that by this date id had all my christmas decorations up but im not finish even with the lights,0
i was feeling and was surprised when i told him i felt fine no fatigue,0
i posted i think it was about feeling sorta shitty and well i didnt want that to be the last post in my blog any more,0
i feel mellow antonios,0
i get the feeling that im butchering a feeling that was as delicate as it was wordless but so be it,0
ill dream about sol and wake up feeling distressed,0
i feel a little frantic because i know peoples will be leaving soon and just a little while ago i felt like i had hella time to waste and to hold off on things,0
i recommend bacon for dinner if you want to feel like youre doing something naughty,0
im feeling playful i thought i would share my answers with you folks,0
i still feel extremely helpless,0
i feel strong for a few reasons,0
i feel thankful to be strong enough and courageous enough to have taken the steps to change my life,0
i also find that it gives me a light energy lift and maybe this is my imagination but i also feel a connection and partnership with my plant friends which is a terrific way to start off the gardening season which i did in earnest this weekend and will post details of during the week ahead,0
i don t know why i should feel humiliated to write about it,0
i am sure he has no idea the way i truly feel not only am i immensely attracted to him but he is intelligent and we can actually enjoy conversation,0
i feel horny a class arialblue href chat,0
ill think about my new sewing room and the awesome feeling it is to have a place where i can be as messy as i like without anyone moaning,0
i am no longer a virgin with girls i m starting to feel very indecisive once again,0
i like the three finger hands those simple details give it that otherworldliness feel again the paint choices while not terrible by any stretch of the imagination it doesn t blow me away and i would have liked to have seen these both in translucent blue,0
i could feel myself getting calm and feeling better,0
i feel embarrassed even typing those absurd words now because the truth is that my son has been living on our countertops since we brought this puppy home two weeks ago,0
i can t write because i feel afraid that my silly little thoughts are not enough to help you,0
i feel like i am an island of pain and i need to be isolated from them all so i dont contaminate them with my sadness,0
i was feeling extremely whiney and lonely and sad,0
i feel better without it,0
i feel a little apprehensive about all of the grue activities this weekend,0
im feeling exhausted today,0
im saying i feel fake,0
i first had cordelia i didnt feel a strong urge to run which is strange for me but it has come back,0
i feel im supposed to hate dams amp all the control of nature that they represent but sometimes they really are the most elegant amp awe inspiring structures,0
i only feel such an aching rush if im hearing it,0
i feel especially troubled is the fact that these israelis arguably constitute the section of society most inclined to reach a deal with the palestinians,0
i have tried to live a good honest life and yet it feels like im being punished,0
i wont say the insecure feelings are gone but if i feel shitty i just grab the card and read it,0
i wrote feel there rather than think or believe because i know objectively that i am smart probably smarter than most people but most of the time im more conscious of what i dont know than what i do know,0
i still don t feel devastated by the break up,0
im caught up on sleep and no longer feel like a zombie im excited to focus on being a good wife mother and homemaker again,0
i suppose i ended up feeling that some of these clues were a bit too clever for their own good,0
i end up feeling lonely,0
i was very happy with impact made by valbuena and diaby especially the latter who i feel has what it takes to overhaul a shaky usual starter,0
i could feel every muscle in my body working as one to move with grace i know me graceful power and control,0
i am feeling more confident that we will be able to take care of this baby,0
i also feel it is unfortunate that nearly all the readers of going to meet the man will be african americans unlike myself,0
i suppose it all goes along with feeling unwelcome and mostly being shunned,0
i genuinely feel pertaining to him suffering from that stanley said,0
i love your style and feel very comfortable with your writings,0
i would have to think oh the poor lady always being sick always being stressed feeling so isolated,0
i want him to become more fully himself and that is the joy i feel when like yesterday he says with an excited whisper mama,0
i remember wandering down a back road with my father sitting on my throne watching the trees whiz by feeling the rumble of our bike beneath us like a contented giant cat,0
i feel like im being punished for something that i didnt do,0
i don t always feel quite as graceful but that s a story for another time,0
i must say it was first numb then ouch my head feel dazed,0
my last genetices midterm a decent grade,0
im feeling inspired today,0
i was like ya i feel everything i m not numb at all,0
im just feeling insecure and while i can easily diagnose these dispositions it doesnt help,0
i feel so respected now,0
im with my boyfriend and friends i feel fine and genuinely happy but the minute im alone i feel depressed,0
i always feel vaguely suspicious giving my personal details to random strangers i tell myself not to give her my real date of birth,0
i was feeling pret t y tender let me tell you,0
i guess i feel betrayed because i admired him so much and for someone to do this to his wife and kids just goes beyond the pale,0
i just feel its more romantic when these characters do not jump on each other on the first opportunity they get,0
i feel stupid because i didnt buy in sooner,0
i feel that it is something that will never really be resolved,0
i feel ungrateful for stupid shit like,0
i wear funny cartoon t shirts of course with my favorite cartoon characters like bugs bunny and tweety bird that is when i feel humorous and in high spirits like going to a park or a mall with my crazy and dorky friends,0
i feel energetic and excited to see my results at the end of the week,0
i am feeling unsure of how to handle a new phase one of my kids is in or feeling badly for how i ve handled a situation this book is a clear reminder for me that my job is to help teach them each how to make good decisions,0
i feel doubtful and afraid,0
i feel vain today,0
i feel i should share with you this wonderful business concept that will change your life if like me you have little time to spend in the kitchen grocery shopping or browsing the net for new exciting recipes,0
climbing a mountain to see a view,0
i was dribbling on mums coffee table looking out of the window and feeling very happy,0
i learnt that expectations of people are not always met and may leave you feeling immensely disappointed most of the time,0
i am feeling like something sweet there is always fruit,0
i feel blessed that i am allowed to take things for granted,0
i don t know why this makes me feel so distraught,0
im feeling confident about it,0
im feeling slightly more graceful in the ballet of it all but thats always temporary,0
i said earlier that the overall feeling is joyful happy thankful and that s spoken in just about every other post i have of mason,0
i am reading something the saints have written i feel a real pang of sweet pain for the love they have for our lord,0
i dolphins feel sweet taste of victory defeat cincinnati bengals in overtime a href http twitter,0
i feel for goes far beyond artistic reverence,0
im feeling nostalgic about listening to this kind of music again,0
i wish that i could re establish a reasonable level of motivation that isnt predicated on the need to make people feel like less intelligent human beings than they probably are,0
i feel thrilled and quite humbled i wasn t expecting anything like that and it s a funny feeling,0
i guess but it feels like the most unpleasant joke youve ever heard,0
i don t feel sorry for wisdom i know how many sleep hui live to be now and enthusiasm for the new china s socialist construction work,0
i cant help to also feel a little restless,0
i love the foamy feel it is so gentle on the skin doesnt sting or irritate whatsoever,0
i feel like i m just a good actress then maybe,0
i am still feeling good,0
im feeling kinda horny so i just booked a flight from burbank to los angeles,0
i feel i have to do its my creative calling my lifes passion,0
i will never forget as he shot the dye into me telling me ok youre going to feel a hot flash and then it will feel like youve pissed yourself,0
im feeling artistic here are a couple of drawings i did in the dust on ms car after it rained a couple of months ago,0
ive never been particularly bothered about my age or the ageing process and while i feel slightly surprised that im nearly i dont really mind,0
i thought it would be a good time to check in on weasel nation to see how they were feeling about their donut loving coach and their floundering football team,0
im trying to regroup after anatomy as ive been feeling depressed and exhausted for the past three weeks or so,0
i feel stumble a class content link href https plusone,0
i feel like im alone in missing him and because of that i feel a bit foolish for missing him as much as i do,0
i just know to begin with i am going to feel shy about it,0
i can say is that i feel like myself when i put on a skirt heels and lipstick and when i wear clothing which has come to be accepted as neutral and nondescript like a t shirt and jeans i dont feel like myself,0
i feel like i dont need school to be intelligent,0
i suppose a couple days of not feeling so hot is better than whooping cough the visit went really well,0
i feel splendid sublime euphoric,0
i wasnt feeling it and i didnt want to fake it,0
im feeling very remorseful at the moment,0
i was taught to complain and feel unhappy but it was not until quite recently i clearly understood the importance or gratitude and started to make it important in my life,0
i was stone heavier and feeling hopeless,0
i feel like i dont even know how to trust that im trusting well enough,0
i am under pressure at the place i spend most of my week on past experience i will tend to feel more unhappy for longer periods,0
i absolutely love working and the feeling of accomplishment i get from it but i am tangibly physically unhappy with the family life i am missing right now,0
ive this bad feeling that im being hated,0
i feel there are very smart people that can count all these numbers but i am not one,0
i feel lucky really,0
i do go for days as has happened recently i feel clearer and more compassionate,0
i don t know when i will want to tell her and feel guilty and disappointed that everything i am thinking about her and our relationship right now is negative,0
ive been feeling kinda gloomy lately,0
i feel extremely passionate about this topic because that person used to be me,0
i feel so dumb photographing myself okay i even feel dumb trying to smile for justin,0
i feel an ache when my phone chimes and it s not a sweet text from my sweetheart,0
i was literally swishing around in the water feeling like a very unsuccessful drowned hamster,0
i feel gracious what about you,0
i was doing less yoga and feeling more agitated by my impetuous decision,0
i feel strangely sympathetic towards the citizens of the capitol for some reason and the cast s overall chemistry was good the look and feel of the movie was great and i found the story to be engaging and interesting enough to be watchable,0
i am feeling the purpose of caring for those of us who are caregivers as well,0
im still a little mixed on how i feel about him back especially because i liked the a href,0
im on day of feeling lousy but im starting to feel human again,0
i feel assured that everything will be alright regardless of what im currently going through,0
i feel ok about this work because it is not so bad and it is not so good,0
i love this connection with the outdoors hearing the birds just returned from afar and my face getting nipped by the gentle chill of a spring breeze and feeling like im doing something productive,0
that day i was alone at home after coming home from school i did not know where everyone else had gone,0
i have been out there over the last few weeks i experienced for the first time a feeling of loving the actual act of running of pushing my daughter in the jogger of getting outsprinted by my wife although this would happen if i was in top shape anyway of having cold air nail you in the face,0
i feel amazed when i saw the final result even thos without fishes inside,0
i don t always feel a bit homesick,0
im just feeling whiney,0
i started out feeling amazing,0
i feel peaceful with them being where they are but miss them like crazy i get giddy from the picture texts and random phone calls,0
im in so much pain and i feel like a useless lump face,0
i feel so helpless knowing i cant protect them and i worry about the others now,0
i feel like a super hero now that she naps amp sleeps in her crib,0
i am feeling so proud,0
i feel a little lame admitting it because these are not high ticket price items however i didnt want to buy both so i had to make a choice,0
i want a relationship where partners empower each other not feel burdened by their histories and eccentricities,0
i have a well staffed office or a relatively less busy schedule things run more smoothly and i feel less stressed,0
i dont agree with this neo religious terminology or practice as i feel if one is to be faithful to a certain custom how is it believed that say a year old modification in commandment will be just as or more bona fide and sacred than its original gesture,0
i feel pretty shitty and it s not my fault other people don t appreciate what i do but still i can t help feeling as if i deserve it,0
i began to feel woeful as i stared into the abyss of goal less task less list less ness but luckily huda came to the rescue with in,0
i think hes well aware of the internets reactions to gates and igle leaving and i imagine hes probably feeling a bit apprehensive of fans reactions to his work,0
i didn t feel frightened i m rarely scared of any place but i couldn t help feeling uneasy in the company of so many big groups of men and the only woman visible anywhere,0
i feel like if i continue i ll start the babble and bore the heck out of anyone reading so i ll just try to finish it with a few thankful thoughts,0
i feel needy when i ask someone to hang out with me and i end up not trying after a few times of being told no i have plans sorry,0
i am feeling morose for i have been reading wuthering heights,0
i feel like the little dorky nerdy kid sitting in his backyard all by himself listening and watching through fence to the little popular kid having his birthday party with all his cool friends that youve always wished were yours,0
i feel that perhaps an opportunity was missed to look a little closer at the individual stories of the indigo tribe in their offline state it s easy to see that with the hal sinestro antics and the william hand side plot oh,0
i feel like if you shop smart you can still add a few things here and there to your wardrobe without breaking the bank,0
i sit six weeks into my sabbatical and i feel completely worthless,0
i dropped back to sleep for an hour or two and had very realistic peculiar dreams which are now stuck in my head making me feel a bit dazed,0
